{
  "modelId": "REPLACE_WITH_VALIDATED_RESEARCH_MODEL",
  "modelVersion": "0.0.0",
  "caseId": "research-case",
  "generatedAtUtc": "2026-09-30T00:00:00Z",
  "findings": [
    {
      "id": "EXAMPLE-001",
      "vessel": "RCA",
      "segment": "proximal",
      "findingType": "suspected_occlusion",
      "confidence": 0.91,
      "priority": "HighPriorityReview",
      "explanation": "EXAMPLE DATA ONLY. Replace with evidence generated by a validated research pipeline.",
      "measurementSummary": "EXAMPLE ONLY",
      "evidence": [
        {
          "sourceId": "SER-REPLACE_ME",
          "frameStart": 10,
          "frameEnd": 20,
          "projection": "REPLACE_ME",
          "description": "EXAMPLE evidence reference only"
        }
      ]
    }
  ]
}